"Fabio Bretas de Freitas and Phy Capital Investments LLC","","","","$22,986,190","$0","$22,986,190","2019","20191015","financial offenses","investor protection violation","","fraud and misappropriation","federal","agency action","Commodity Futures Trading Commission","civil","","","","","","","","","","","","","","","","","","","","","","https://www.cftc.gov/PressRoom/PressReleases/8052-19","",""
"BGC Financial, LP","BGC Partners","BGC Partners","","$15,000,000","$0","$15,000,000","2019","20191002","financial offenses","investor protection violation","","Brokers employed by BGC on its emerging markets foreign exchange options desk made false representations that certain bids and offers were executable and that certain trades had occurred. ","federal","agency action","Commodity Futures Trading Commission","civil","","","","","","","","","","","","","","","USA","New York","publicly traded","BGCP","US05541T1016","financial services","brokerage and financial technology","https://www.cftc.gov/PressRoom/PressReleases/8035-19","",""
"GFI Securities, LLC","BGC Partners","BGC Partners","","$10,000,000","$0","$10,000,000","2019","20191002","financial offenses","investor protection violation","","Brokers employed by GFI on its emerging markets foreign exchange options desk made false representations that certain bids and offers were executable and that certain trades had occurred. ","federal","agency action","Commodity Futures Trading Commission","civil","","","","","","","","","","","","","","","USA","New York","publicly traded","BGCP","US05541T1016","financial services","brokerage and financial technology","https://www.cftc.gov/PressRoom/PressReleases/8035-19","",""
"Mitsubishi International Corporation","Mitsubishi Corporation","Mitsubishi Corporation","","$400,000","$0","$400,000","2019","20191001","financial offenses","investor protection violation","","spoofing violation","federal","agency action","Commodity Futures Trading Commission","civil","","","","","","","","","","","","","","","Japan","","publicly traded","","JP3898400001","diversified","diversified trading company","https://www.cftc.gov/PressRoom/PressReleases/8046-19","",""
"Belvedere Trading LLC","","","","$1,100,000","$0","$1,100,000","2019","20191001","financial offenses","investor protection violation","","spoofing violation","federal","agency action","Commodity Futures Trading Commission","civil","","","","","","","","","","","","","","","","","","","","","","https://www.cftc.gov/PressRoom/PressReleases/8045-19","",""
"Morgan Stanley Capital Group Inc.","Morgan Stanley","Morgan Stanley","","$1,500,000","$0","$1,500,000","2019","20191001","financial offenses","investor protection violation","","spoofing violation","federal","agency action","Commodity Futures Trading Commission","civil","","","","","","","","","","","","","","","USA","New York","publicly traded","MS","US6174464486","financial services","financial services","https://www.cftc.gov/PressRoom/PressReleases/8044-19","",""
"PNC Bank, National Association","PNC Financial Services","PNC Financial Services","","$300,000","$0","$300,000","2019","20191001","financial offenses","investor protection violation","","swaps reporting violation","federal","agency action","Commodity Futures Trading Commission","civil","","","","","","","","","","","","","","","USA","Pennsylvania","publicly traded","PNC","US6934751057","financial services","banking","https://www.cftc.gov/PressRoom/PressReleases/8043-19","",""
"Bank of New York Mellon","Bank of New York Mellon","Bank of New York Mellon","","$750,000","$0","$750,000","2019","20191001","financial offenses","investor protection violation","","swaps reporting violation","federal","agency action","Commodity Futures Trading Commission","civil","","","","","","","","","","","","","","","USA","New York","publicly traded","BK","US0640581007","financial services","banking","https://www.cftc.gov/PressRoom/PressReleases/8042-19","",""
"NatWest Markets Plc","NatWest Group PLC","NatWest Group PLC","RBS Group changed its name to NatWest Group in 2020","$850,000","$0","$850,000","2019","20191001","financial offenses","investor protection violation","","swaps reporting violation","federal","agency action","Commodity Futures Trading Commission","civil","","","","","","","","","","","","","","","United Kingdom","","government-owned","LSE: NWG","GB00B7T77214","financial services","banking & securities","https://www.cftc.gov/PressRoom/PressReleases/8041-19","",""
"Northern Trust Company","Northern Trust","Northern Trust","","$1,000,000","$0","$1,000,000","2019","20191001","financial offenses","investor protection violation","","swaps reporting violation","federal","agency action","Commodity Futures Trading Commission","civil","","","","","","","","","","","","","","","USA","Illinois","publicly traded","NTRS","US6658591044","financial services","banking","https://www.cftc.gov/PressRoom/PressReleases/8040-19","",""
"Societe Generale International Limited","Societe Generale","Societe Generale","","$2,500,000","$0","$2,500,000","2019","20191001","financial offenses","investor protection violation","financial institution supervision failures","swaps reporting violation","federal","agency action","Commodity Futures Trading Commission","civil","","","","","","","","","","","","","","","France","","publicly traded","","FR0000130809","financial services","banking","https://www.cftc.gov/PressRoom/PressReleases/8039-19","",""
"HSBC Bank USA, N.A.","HSBC","HSBC","","$650,000","$0","$650,000","2019","20191001","financial offenses","investor protection violation","","swaps violation","federal","agency action","Commodity Futures Trading Commission","civil","","","","","","","","","","","","","","","United Kingdom","","publicly traded","LSE: HSBA","GB0005405286","financial services","banking","https://www.cftc.gov/PressRoom/PressReleases/8038-19","",""
"RBC Capital Markets, LLC","Royal Bank of Canada","Royal Bank of Canada","","$5,000,000","$0","$5,000,000","2019","20191001","financial offenses","investor protection violation","financial institution supervision failures","The U.S. Commodity Futures Trading Commissionannounced an order filing and setting charges against RBC Capital Markets, LLC, a registered futures commission merchant, for failing to meet its supervisory obligations, which resulted in hundreds of unlawful trades and other violations over the period of at least late 2011 through May 2017.","federal","agency action","Commodity Futures Trading Commission","civil","","","","","","","","","","","","","","","Canada","","publicly traded","NYSE: RY","CA7800871021","financial services","banking","https://www.cftc.gov/PressRoom/PressReleases/8034-19","",""
"Classic Energy LLC","","","","$1,500,000","$0","$1,500,000","2019","20191001","financial offenses","investor protection violation","financial institution supervision failures","misusing material, nonpublic order information in connection with block trades in natural gas futures on ICE Futures US, as well as related supervision and recordkeeping violations","federal","agency action","Commodity Futures Trading Commission","civil","","","","","","","","","","","","","","","","","","","","","","https://www.cftc.gov/PressRoom/PressReleases/8030-19","",""
"CHS, Inc.","CHS Inc.","CHS Inc.","","$500,000","$0","$500,000","2019","20191001","financial offenses","investor protection violation","","failing to submit accurate monthly CFTC Form 204 Reports regarding the composition of CHS's fixed price cash corn and soybean purchases and sales","federal","agency action","Commodity Futures Trading Commission","civil","","","","","","","","","","","","","","","USA","Minnesota","cooperative","","","agribusiness","agribusiness","https://www.cftc.gov/PressRoom/PressReleases/8029-19","",""
"Intergrain S.A.","","","","$175,000","$0","$175,000","2019","20190930","financial offenses","investor protection violation","","failing to file timely CFTC Form 204 Reports","federal","agency action","Commodity Futures Trading Commission","civil","","","","","","","","","","","","","","","","","","","","","","https://www.cftc.gov/PressRoom/PressReleases/8028-19","",""
"Hard Eight Futures, LLC","","","","$1,750,000","$0","$1,750,000","2019","20190930","financial offenses","investor protection violation","","spoofing violation","federal","agency action","Commodity Futures Trading Commission","civil","","","","","","","","","","","","","","","","","","","","","","https://www.cftc.gov/PressRoom/PressReleases/8024-19","",""
"ARMKAT LLC","","","","$140,000","$0","$140,000","2019","20190925","financial offenses","investor protection violation","","","federal","agency action","Commodity Futures Trading Commission","civil","","","","","","","","","","","","","","","","","","","","","","https://www.cftc.gov/PressRoom/PressReleases/8021-19","",""
"Heraeus Metals New York LLC","Heraeus","Heraeus","","$130,000","$0","$130,000","2019","20190916","financial offenses","investor protection violation","","spoofing violation","federal","agency action","Commodity Futures Trading Commission","civil","","","","","","","","","","","","","","","Germany","","privately held","","","diversified","diversified","https://www.cftc.gov/PressRoom/PressReleases/8015-19","",""
"Tullett Prebon Americas Inc.","","","","$13,000,000","$0","$13,000,000","2019","20190913","financial offenses","investor protection violation","financial institution supervision failures","The U.S. Commodity Futures Trading Commission issued two orders filing and settling charges against Tullett Prebon Americas Inc., an interdealer broker and CFTC-registered introducing broker headquartered in New Jersey. The combined orders required Tullett to pay a total of $13 million for failing to supervise employees and making false or misleading statements to CFTC staff.","federal","agency action","Commodity Futures Trading Commission","civil","","","","","","","","","","","","","","","","","","","","","","https://www.cftc.gov/PressRoom/PressReleases/8012-19","",""
"Phillip Capital Inc.","","","","$1,500,000","$0","$1,500,000","2019","20190912","consumer-protection-related offenses","privacy violation","investor protection violation","cyber breach","federal","agency action","Commodity Futures Trading Commission","civil","","","","","","","","","","","","","","","","","","","","","","https://www.cftc.gov/PressRoom/PressReleases/8008-19","",""
"Merrill Lynch, Pierce, Fenner & Smith Incorporated","Bank of America","Bank of America","","$300,000","$0","$300,000","2019","20190910","financial offenses","investor protection violation","financial institution supervision failures","Failing to promptly produce to the CFTC certain required records and, separately, failing to supervise its employees and agents to ensure that they fulfilled the firm's statutory and regulatory obligations to keep and promptly produce such records.","federal","agency action","Commodity Futures Trading Commission","civil","","","","","","","","","","","","","","","USA","North Carolina","publicly traded","NYSE: BAC","US0605051046","financial services","banking","https://www.cftc.gov/PressRoom/PressReleases/8005-19","",""
"Dinar Corp., Inc. and My Monex, Inc.","","","","$22,600,000","$0","$22,600,000","2020","20200221","financial offenses","investor protection violation","","The companies were ordered to pay $22.6 million in disgorgement and civil monetary penalties in connection with a fraudulent foreign currency scheme.","federal","agency action","Commodity Futures Trading Commission","civil","","","","","","","","","","","","","","","","","","","","","","https://www.cftc.gov/PressRoom/PressReleases/8122-20","",""
"Catalyst Capital Advisors LLC","","","","$10,208,481","$0","$10,208,481","2020","20200127","financial offenses","investor protection violation","financial institution supervision failures","","federal","agency action","Commodity Futures Trading Commission","civil","","","","","","","","","","","","","","","","","","","","","","https://www.cftc.gov/PressRoom/PressReleases/8109-20","",""
"Mirae Asset Daewoo Co., Ltd.","","","","$700,000","$0","$700,000","2020","20200113","financial offenses","investor protection violation","","spoofing","federal","agency action","Commodity Futures Trading Commission","civil","","","","","","","","","","","","","","","","","","","","","","https://www.cftc.gov/PressRoom/PressReleases/8104-19","",""
"Goldman Sachs & Co. LLC","Goldman Sachs","Goldman Sachs","","$1,000,000","$0","$1,000,000","2019","20191126","financial offenses","investor protection violation","","","federal","agency action","Commodity Futures Trading Commission","civil","","","","","","","","","","","","","","","USA","New York","publicly traded","NYSE: GS","US38141G1040","financial services","banking & securities","https://www.cftc.gov/PressRoom/PressReleases/8086-19","",""
"Gain Capital UK Limited","","","","$491,671","$0","$491,671","2020","20200608","financial offenses","investor protection violation","financial institution supervision failures","","federal","agency action","Commodity Futures Trading Commission","civil","","","","","","","","","","","","","","","","","","","","","","https://www.cftc.gov/PressRoom/PressReleases/8174-20","",""
"FuturesFX","","","","$1,750,000","$0","$1,750,000","2020","20200423","financial offenses","investor protection violation","","","federal","agency action","Commodity Futures Trading Commission","civil","","","","","","","","","","","","","","","","","","","","","","https://www.cftc.gov/PressRoom/PressReleases/8157-20","",""
"Amada Capital Management LLC","","","","$596,700","$0","$596,700","2020","20200417","financial offenses","investor protection violation","","","federal","agency action","Commodity Futures Trading Commission","civil","","","","","","","","","","","","","","","","","","","","","","https://www.cftc.gov/PressRoom/PressReleases/8149-20","",""
"Edge Financial Technologies, LLC","","","","$145,200","$0","$145,200","2020","20200915","financial offenses","investor protection violation","","","federal","agency action","Commodity Futures Trading Commission","civil","","","","","","","","","","","","","","","","","","","","","","https://www.cftc.gov/PressRoom/PressReleases/8243-20","",""
"OANDA Corporation","","","","$500,000","$0","$500,000","2020","20200821","financial offenses","investor protection violation","financial institution supervision failures","","federal","agency action","Commodity Futures Trading Commission","civil","","","","","","","","","","","","","","","","","","","","","","https://www.cftc.gov/PressRoom/PressReleases/8224-20","",""
"The Bank of Nova Scotia","Scotiabank","Scotiabank","","$50,000,000","$0","$50,000,000","2020","20200819","financial offenses","investor protection violation","financial institution supervision failures","The Bank of Nova Scotia agreed to pay $50 million to settle allegation of swap dealer compliance failures, failing to supervise its swap dealer activities diligently, and making false or misleading statements to CFTC staff during the course of the Division of Enforcement's investigation.","federal","agency action","Commodity Futures Trading Commission","civil","","","","","","","","","","","","","","","Canada","","publicly traded","","CA0641491075","financial services","banking","https://www.cftc.gov/PressRoom/PressReleases/8222-20","",""
"The Bank of Nova Scotia","Scotiabank","Scotiabank","","$77,400,000","$0","$77,400,000","2020","20200819","financial offenses","investor protection violation","financial institution supervision failures","The Commodity Futures Trading Commission issued two orders filing and settling charges against The Bank of Nova Scotia, a provisionally registered swap dealer, arising from manipulative and deceptive conduct, spanning more than eight years and involving thousands of occasions of attempted manipulation and spoofing in gold and silver futures contracts traded on the Commodity Exchange, Inc. (COMEX). The combined orders required BNS to pay a total of $77.4 million in penalties and equitable relief, including a record-setting $17 million for making false and misleading statements to CFTC staff during the investigation into the bank's spoofing and a total of $60.4 million for spoofing and attempted manipulation. In addition to monetary sanctions, the spoofing order required BNS to retain an independent compliance monitor. The annnoucement stated that a portion of the penalty would be offet by payments made to the Justice Department in a related case (see separate entry) but does not indicate how much.","federal","agency action","Commodity Futures Trading Commission","civil","","","","","","","","","","","","","","","Canada","","publicly traded","","CA0641491075","financial services","banking","https://www.cftc.gov/PressRoom/PressReleases/8221-20","",""
"Interactive Brokers LLC","Interactive Brokers Group","Interactive Brokers Group","","$12,206,214","$0","$12,206,214","2020","20200810","financial offenses","anti-money-laundering deficiencies","financial institution supervision failures","","federal","agency action","Commodity Futures Trading Commission","civil","","","","","","","","","","","","","","","USA","Connecticut","publicly traded","IBKR","US45841N1072","financial services","stock brokerage","https://www.cftc.gov/PressRoom/PressReleases/8218-20","",""
"New York Mercantile Exchange (NYMEX)","","","","$4,000,000","$0","$4,000,000","2020","20200804","financial offenses","investor protection violation","financial institution supervision failures","disclosure of material non-public information","federal","agency action","Commodity Futures Trading Commission","civil","","","","","","","","","","","","","","","","","","","","","","https://www.cftc.gov/PressRoom/PressReleases/8216-20","",""
"Southwest Group, LLC","","","","$75,000","$0","$75,000","2020","20200720","financial offenses","investor protection violation","","","federal","agency action","Commodity Futures Trading Commission","civil","","","","","","","","","","","","","","","","","","","","","","https://www.cftc.gov/PressRoom/PressReleases/8207-20","",""
"Plutus Financial, Inc. d/b/a Abra","","","","$150,000","$0","$150,000","2020","20200713","financial offenses","investor protection violation","","","federal","agency action","Commodity Futures Trading Commission","civil","","","","","","","","","","","","","","","","","","","","","","https://www.cftc.gov/PressRoom/PressReleases/8201-20","",""
"Perfection PR Firm LLC","","","","$1,296,572","$0","$1,296,572","2020","20200710","financial offenses","investor protection violation","","","federal","agency action","Commodity Futures Trading Commission","civil","","","","","","","","","","","","","","","","","","","","","","https://www.cftc.gov/PressRoom/PressReleases/8200-20","",""
"Foremost Trading LLC","","","","$923,013","$0","$923,013","2020","20200706","financial offenses","investor protection violation","","","federal","agency action","Commodity Futures Trading Commission","civil","","","","","","","","","","","","","","","","","","","","","","https://www.cftc.gov/PressRoom/PressReleases/8194-20","",""
"Cunningham Commodities, LLC","","","","$250,000","$0","$250,000","2020","20200629","financial offenses","investor protection violation","financial institution supervision failures","","federal","agency action","Commodity Futures Trading Commission","civil","","","","","","","","","","","","","","","","","","","","","","https://www.cftc.gov/PressRoom/PressReleases/8191-20","",""
"VOS Capital Management, LLC","","","","$3,813,875","$0","$3,813,875","2020","20200623","financial offenses","investor protection violation","fraud","","federal","agency action","Commodity Futures Trading Commission","civil","","","","","","","","","","","","","","","","","","","","","","https://www.cftc.gov/PressRoom/PressReleases/8217-20","",""
"Deutsche Bank AG","Deutsche Bank","Deutsche Bank","","$9,000,000","$0","$9,000,000","2020","20200618","financial offenses","investor protection violation","","alleged violations of various swap data reporting requirements","federal","agency action","Commodity Futures Trading Commission","civil","","","","","","","","","","","","","","","Germany","","publicly traded","","DE0005140008","financial services","banking & securities","https://www.cftc.gov/PressRoom/PressReleases/8185-20","",""
"Deutsche Bank Securities Inc.","Deutsche Bank","Deutsche Bank","","$1,250,000","$0","$1,250,000","2020","20200618","financial offenses","investor protection violation","","spoofing","federal","agency action","Commodity Futures Trading Commission","civil","","","","","","","","","","","","","","","Germany","","publicly traded","","DE0005140008","financial services","banking & securities","https://www.cftc.gov/PressRoom/PressReleases/8185-20","",""
"Vitol Inc.","Vitol","Vitol","","$95,700,000","$95,700,000","$0","2020","20201203","competition-related offenses","fraud","energy market manipulation","The CFTC issued an order filing and settling charges against Vitol Inc., an energy and commodities trading firm in Houston, Texas, for manipulative and deceptive conduct. The conduct, which spanned from 2005 to early 2020, involved foreign corruption and physical and derivatives trading in the U.S. and global oil markets, including attempted manipulation of two S&P Global Platts physical oil benchmarks. The order requires Vitol to pay more than $95 million in civil monetary penalties and disgorgement. The CFTC action overlaps with a Justice Department Foreign Corrupt Practices Act criminal action (see separate entry).","federal","agency action","Commodity Futures Trading Commission","civil","","","","","","","","","","","","","","","Switzerland","","privately held","","","financial services","energy and commodity trading","https://www.cftc.gov/PressRoom/PressReleases/8326-20","",""
"Venture Capital Investments LLC","","","","$900,604","$0","$900,604","2020","20201104","financial offenses","investor protection violation","","","federal","agency action","Commodity Futures Trading Commission","civil","","","","","","","","","","","","","","","","","","","","","","https://www.cftc.gov/PressRoom/PressReleases/8304-20","",""
"Black Diamond Forex LP, BDF Trading LP, and Advanta FX","","","","$1,200,000","$0","$1,200,000","2020","20201009","financial offenses","investor protection violation","","","federal","agency action","Commodity Futures Trading Commission","civil","","","","","","","","","","","","","","","","","","","","","","https://www.cftc.gov/PressRoom/PressReleases/8283-20","",""
"Morgan Stanley Capital Services LLC","Morgan Stanley","Morgan Stanley","","$5,000,000","$0","$5,000,000","2020","20200930","financial offenses","investor protection violation","","swap data violations","federal","agency action","Commodity Futures Trading Commission","civil","","","","","","","","","","","","","","","USA","New York","publicly traded","MS","US6174464486","financial services","financial services","https://www.cftc.gov/PressRoom/PressReleases/8269-20","",""
"A&A Trading, Inc.","","","","$495,329","$0","$495,329","2020","20200930","financial offenses","investor protection violation","financial institution supervision failures","","federal","agency action","Commodity Futures Trading Commission","civil","","","","","","","","","","","","","","","","","","","","","","https://www.cftc.gov/PressRoom/PressReleases/8268-20","",""
"Sunoco LP","Energy Transfer","Energy Transfer","","$450,000","$0","$450,000","2020","20200930","financial offenses","investor protection violation","","spoofing violations","federal","agency action","Commodity Futures Trading Commission","civil","","","","","","","","","","","","","","","USA","Texas","publicly traded","ET","US29273V1008","pipelines","pipelines","https://www.cftc.gov/PressRoom/PressReleases/8267-20","",""
"ARB Trading Group LP","","","","$445,000","$0","$445,000","2020","20200930","financial offenses","investor protection violation","","spoofing violations","federal","agency action","Commodity Futures Trading Commission","civil","","","","","","","","","","","","","","","","","","","","","","https://www.cftc.gov/PressRoom/PressReleases/8265-20","",""
"Gain Capital Group, LLC","StoneX Group","StoneX Group","","$300,000","$0","$300,000","2020","20200929","financial offenses","investor protection violation","financial institution supervision failures","","federal","agency action","Commodity Futures Trading Commission","civil","","","","","","","","","","","","","","","USA","New York","publicly traded","SNEX","US8618961085","financial services","commodities brokerage","https://www.cftc.gov/PressRoom/PressReleases/8263-20","",""
"JPMorgan Chase & Company","JPMorgan Chase","JPMorgan Chase","","$920,200,000","$0","$920,200,000","2020","20200929","financial offenses","investor protection violation","","The Commodity Futures Trading Commission issued an order filing and settling charges against JPMorgan Chase & Company and its subsidiaries, JPMorgan Chase Bank, N.A., and J.P. Morgan Securities LLC, for manipulative and deceptive conduct and spoofing that spanned at least eight years and involved hundreds of thousands of spoof orders in precious metals and U.S. Treasury futures contracts on the Commodity Exchange, Inc., the New York Mercantile Exchange, and the Chicago Board of Trade. The case overlaps with a criminal action brought by the U.S. Justice Department (see separate entry).","federal","agency action","Commodity Futures Trading Commission","civil","","","","","","","","","","","","","","","USA","New York","publicly traded","NYSE: JPM","US46625H1005","financial services","banking & securities","https://www.cftc.gov/PressRoom/PressReleases/8260-20","",""
