"Company","Current Parent Company","Parent at the Time of the Penalty Announcement","Recap of Ownership Changes","Penalty Amount","Subtraction From Penalty Amount to Avoid Double Counting","Penalty Amount Adjusted For Eliminating Multiple Counting","Penalty Year","Penalty Date","Offense Group","Primary Offense","Secondary Offense","Description","Level of Government","Action Type","Agency","Civil/Criminal","Prosecution Agreement","Court","Case ID","Private Litigation Case Title","Lawsuit Resolution","Original System ID","Facility Name","Facility Address","Facility City","Facility State","Facility Zip","Facility County","NAICS Code","NAICS Translation","Current Parent HQ Country","Current Parent HQ State","Current Parent Ownership Structure","Current Parent Stock Ticker","Current Parent ISIN","Current Parent Major Industry","Current Parent Specific Industry","Info Source","PACER Link","Notes"
"Air Shunt Instruments Inc.","","","","$250,000","$0","$250,000","2008","20080717","competition-related offenses","export control violation","","Air Shunt Instruments Inc., a California aircraft components company, was sentenced to pay a criminal fine of $250,000 for false statements related to the illegal export of military technology.","federal","agency action","Justice Department National Security Division","criminal","","","","","","","","","","","","","","","","","","","","","","https://www.justice.gov/archive/opa/pr/2008/July/08-nsd-623.html","",""
"Aviation Services International, B.V.","","","","$100,000","$0","$100,000","2009","20090924","competition-related offenses","export control violation","","A Dutch aviation services company was sentenced to five years of probation and a $100,000 fine after pleading guilty to federal charges related to a conspiracy to illegally export aircraft components and other items from the United States to entities in Iran via the Netherlands, the United Arab Emirates and Cyprus.","federal","agency action","Justice Department National Security Division","criminal","","","","","","","","","","","","","","","","","","","","","","https://www.justice.gov/opa/pr/dutch-firm-and-two-officers-plead-guilty-conspiracy-export-aircraft-components-and-other","",""
"Balli Aviation Ltd.","Balli Group","Balli Group","","$2,000,000","$0","$2,000,000","2010","20100511","competition-related offenses","export control violation","","Balli Aviation Ltd., a subsidiary of the United Kingdom-based Balli Group PLC, was sentenced to pay a $2 million fine and to serve a five-year corporate period of probation after pleading guilty on Feb. 5, 2010, to a two-count criminal information in connection with its illegal export of commercial Boeing 747 aircraft from the United States to Iran.","federal","agency action","Justice Department National Security Division","criminal","","","","","","","","","","","","","","","United Kingdom","","privately held","","","financial services","commodities","https://www.justice.gov/opa/pr/uk-firm-fined-2-million-after-pleading-guilty-illegally-exporting-boeing-747-aircraft-iran","",""
"Chiquita Brands International Inc.","Chiquita Brands International","Chiquita Brands International","In 2014 Chiquita was purchased by Cutrale and Safra Group, each with a 50 percent share.","$25,000,000","$0","$25,000,000","2007","20070319","miscellaneous offenses","payment to designated terrorist organization","","Chiquita Brands International Inc. pleaded guilty to one count of engaging in transactions with a terrorist organization in Colombia.","federal","agency action","Justice Department National Security Division","criminal","","","","","","","","","","","","","","","USA","Florida","joint venture (owned 50-50 by Cutrale and Safra Group)","","","food products","bananas","https://www.justice.gov/archive/opa/pr/2007/March/07_nsd_161.html","",""
"GWC Valve International Inc","","","","$710,833","$0","$710,833","2011","20110509","competition-related offenses","export control violation","","GWC Valve International was sentenced to to a criminal fine of $300,000 and five years of corporate probation and ordered to forfeit $410,833.82 in connection after pleading guilty to charges of violating restrictions on the export of industrial valves to Iran.","federal","agency action","Justice Department National Security Division","criminal","","","","","","","","","","","","","","","","","","","","","","https://www.justice.gov/opa/pr/california-company-and-its-ceo-sentenced-conspiring-illegally-export-industrial-valves-iran","",""
"ITT Corporation","L3Harris Technologies","ITT Corporation","In 2011 ITT spun off its military businesses as Exelis Inc. In 2015 Exelis was acquired by Harris Corp., which in 2019 merged with L3 Technologies to form L3Harris Technologies.","$50,000,000","$0","$50,000,000","2007","20070327","miscellaneous offenses","misuse of classified data","Arms Export Control Act","ITT Corporation, the leading manufacturer of military night vision equipment for the U.S. Armed Forces, admitted sending classified materials overseas and agreed to pay a $100 million criminal penalty, half of which was deferred. ","federal","agency action","Justice Department National Security Division","criminal","deferred prosecution agreement","","","","","","","","","","","","","","USA","Florida","publicly traded","LHX","US5024311095","aerospace and military contracting","aerospace & military contracting","https://www.justice.gov/archive/opa/pr/2007/March/07_nsd_192.html","",""
"ZTE Corporation","ZTE","ZTE","","$430,488,798","$0","$430,488,798","2017","20170307","competition-related offenses","export control violation","","ZTE Corporation agreed to enter a guilty plea and to pay a $430,488,798 penalty to the U.S. for conspiring to violate the International Emergency Economic Powers Act by illegally shipping U.S.-origin items to Iran, obstructing justice and making a material false statement. The plea agreement required that ZTE pay a fine in the amount of $286,992,532 and a criminal forfeiture in the amount of $143,496,266.","federal","agency action","Justice Department National Security Division","civil and criminal","","","","","","","","","","","","","","","China","","publicly traded","","CNE000000TK5","telecommunications","telecommunications","https://www.justice.gov/opa/pr/zte-corporation-agrees-plead-guilty-and-pay-over-4304-million-violating-us-sanctions-sending","",""
"Robbins & Myers Belgium S.A.","NOV Inc.","NOV Inc.","National Oilwell Varco changed its name to NOV in 2021","$1,000,000","$0","$1,000,000","2014","20141002","competition-related offenses","export control violation","","","federal","agency action","Justice Department National Security Division","criminal","","","","","","","","","","","","","","","USA","Texas","publicly traded","NOV","US62955J1034","oilfield services and supplies","oilfield equipment","https://www.justice.gov/opa/pr/foreign-subsidiary-texas-oil-firm-pleads-guilty-illegally-exporting-drilling-equipment-syria","",""
"Yang Ban Corporation","","","","$673,714","$0","$673,714","2020","20200831","competition-related offenses","export control violation","money laundering","","federal","agency action","Justice Department National Security Division","criminal","","","","","","","","","","","","","","","","","","","","","","https://www.justice.gov/opa/pr/company-pleads-guilty-money-laundering-violation-part-scheme-circumvent-north-korean","",""
"Essentra FZE Company Limited","","","","$665,112","$0","$665,112","2020","20200716","competition-related offenses","export control violation","","","federal","agency action","Justice Department National Security Division","criminal","deferred prosecution agreement","","","","","","","","","","","","","","","","","","","","","https://www.justice.gov/opa/pr/essentra-fze-admits-north-korean-sanctions-and-fraud-violations-agrees-pay-fine","",""
"United Microelectronics Corporation, Inc.","","","","$60,000,000","$0","$60,000,000","2020","20201028","competition-related offenses","theft of trade secrets","","United Microelectronics Corporation, Inc., a Taiwan semiconductor foundry, pleaded guilty to criminal trade secret theft and was sentenced to pay a $60 million fine, in exchange for its agreement to cooperate with the government in the investigation and prosecution of its co-defendant, a Chinese state-owned-enterprise.","federal","agency action","Justice Department National Security Division","criminal","","","","","","","","","","","","","","","","","","","","","","https://www.justice.gov/opa/pr/taiwan-company-pleads-guilty-trade-secret-theft-criminal-case-involving-prc-state-owned","",""
"PT Bukit Muria Jaya","","","","$1,561,570","$0","$1,561,570","2021","20210117","competition-related offenses","fraud","","A global supplier of cigarette paper products, PT Bukit Muria Jaya, agreed to pay a fine of $1,561,570 and enter into a deferred prosecution agreement with the Justice Department for conspiring to commit bank fraud in connection with the shipment of products to North Korean customers.","federal","agency action","Justice Department National Security Division","criminal","deferred prosecution agreement","","","","","","","","","","","","","","","","","","","","","https://www.justice.gov/opa/pr/indonesian-company-admits-deceiving-us-banks-order-trade-north-korea-agrees-pay-fine-more-15","",""
"SAP SE","SAP","SAP","","$5,140,000","$0","$5,140,000","2021","20210429","financial offenses","economic sanction violation","","SAP acknowledged violations of the Export Administration Regulations and the Iranian Transactions and Sanctions Regulations. As a result of its voluntary disclosure to DOJ, extensive cooperation and strong remediation costing more than $27 million, DOJ's National Security Division (NSD) and the U.S. Attorney's Office for the District of Massachusetts entered into a Non-Prosecution Agreement with SAP. Pursuant to that agreement, SAP agreed to disgorge $5.14 million of ill-gotten gain.","federal","agency action","Justice Department National Security Division","criminal","non-prosecution agreement","","","","","","","","","","","","","","Germany","","publicly traded","","DE0007164600","information technology","software","https://www.justice.gov/opa/pr/sap-admits-thousands-illegal-exports-its-software-products-iran-and-enters-non-prosecution","",""
"Avnet Asia Pte. Ltd.","Avnet","Avnet","","$1,508,000","$0","$1,508,000","2021","20210129","financial offenses","economic sanction violation","","Avnet Asia Pte. Ltd. agreed to pay $1,508,000 and enter into a non-prosecution agreement after admitting responsibility for an employee's unlawful conspiracy to ship export-controlled U.S. goods with potential military applications to China, and also for the criminal conduct of another former employee who, from 2007-2009, illegally caused U.S. goods to be shipped to China and Iran without a license.","federal","agency action","Justice Department National Security Division","criminal","non-prosecution agreement","","","","","","","","","","","","","","USA","Arizona","publicly traded","AVT","US0538071038","wholesalers","wholesalers-electronic equipment","https://www.justice.gov/opa/pr/chinese-national-charged-criminal-conspiracy-export-us-power-amplifiers-china","",""
"British American Tobacco","British American Tobacco","British American Tobacco","","$629,000,000","$0","$629,000,000","2023","20230425","financial offenses","economic sanction violation","","British American Tobacco (BAT) and its subsidiary, BAT Marketing Singapore (BATMS), one of the world's largest manufacturers of tobacco products, agreed to pay combined penalties of more than $629 million to resolve bank fraud and sanctions violations charges with U.S. authorities, arising out of the companies' scheme to do business in North Korea through a third-party company in Singapore, in violation of the bank fraud statute and the International Emergency Economic Powers Act (IEEPA).  BATMS pleaded guilty to a criminal information filed in the District of Columbia charging BAT and BATMS with conspiracy to commit bank fraud and conspiracy to violate IEEPA. BAT entered into a deferred prosecution agreement (DPA) related to the same charges.","federal","agency action","Justice Department National Security Division","civil and criminal","deferred prosecution agreement","","","","","","","","","","","","","","United Kingdom","","publicly traded","LSE: BATS","GB0002875804","tobacco","tobacco","https://www.justice.gov/opa/pr/united-states-obtains-629-million-settlement-british-american-tobacco-resolve-illegal-sales","",""
"DES International Co. Ltd.","","","","$83,769","$0","$83,769","2023","20230418","competition-related offenses","export control violation","","Taiwan business organization DES International Co. Ltd. (DES), and Brunei business organization Soltech Industry Co. Ltd. (Soltech) each pleaded guilty to conspiring to defraud the United States and to violate the International Emergency Economic Powers Act and the Iranian Transactions and Sanctions Regulations. The two companies were each sentenced to pay a fine of $83,769, which is three times the value of the goods unlawfully exported to Iran, and to serve a five-year term of corporate probation.","federal","agency action","Justice Department National Security Division","criminal","","","","","","","","","","","","","","","","","","","","","","https://www.justice.gov/opa/pr/international-business-organizations-convicted-criminal-conspiracy-violate-iranian-sanctions","",""
"Soltech Industry Co. Ltd.","","","","$83,769","$0","$83,769","2023","20230418","competition-related offenses","export control violation","","Taiwan business organization DES International Co. Ltd. (DES), and Brunei business organization Soltech Industry Co. Ltd. (Soltech) each pleaded guilty to conspiring to defraud the United States and to violate the International Emergency Economic Powers Act and the Iranian Transactions and Sanctions Regulations. The two companies were each sentenced to pay a fine of $83,769, which is three times the value of the goods unlawfully exported to Iran, and to serve a five-year term of corporate probation.","federal","agency action","Justice Department National Security Division","criminal","","","","","","","","","","","","","","","","","","","","","","https://www.justice.gov/opa/pr/international-business-organizations-convicted-criminal-conspiracy-violate-iranian-sanctions","",""
"Suez Rajan LimitedÃƒ€š ","","","","$2,500,000","$0","$2,500,000","2023","20230908","financial offenses","economic sanction violation","","Suez Rajan Limited pleaded guilty to conspiring to violate the International Emergency Economic Powers Act through its involvement in the shipment of Iranian crude oil. The company was sentenced to three years of corporate probation and a fine of almost $2.5 million.","federal","agency action","Justice Department National Security Division","criminal","","","","","","","","","","","","","","","","","","","","","","https://www.justice.gov/opa/pr/justice-department-announces-first-criminal-resolution-involving-illicit-sale-and-transport","",""
"Binance Holdings Limited","Binance Holdings","Binance Holdings","","$4,316,126,163","$0","$4,316,126,163","2023","20231121","financial offenses","anti-money-laundering deficiencies","economic sanction violation","Binance Holdings Limited, the entity that operates the world's largest cryptocurrency exchange, Binance.com, pleaded guilty and agreed to pay over $4 billion to resolve the Justice Department's investigation into violations related to the Bank Secrecy Act (BSA), failure to register as a money transmitting business, and the International Emergency Economic Powers Act (IEEPA). As part of the plea agreement, Binance agreed to forfeit $2,510,650,588 and to pay a criminal fine of $1,805,475,575 for a total financial penalty of $4,316,126,163. Binance also agreed to retain an independent compliance monitor for three years and remediate and enhance their anti-money laundering and sanctions compliance programs.","federal","agency action","Justice Department National Security Division","civil and criminal","","","","","","","","","","","","","","","Malta","","privately held","","","financial services","cryptocurrency exchange","https://www.justice.gov/opa/pr/binance-and-ceo-plead-guilty-federal-charges-4b-resolution","",""
