"Company","Current Parent Company","Parent at the Time of the Penalty Announcement","Recap of Ownership Changes","Penalty Amount","Subtraction From Penalty Amount to Avoid Double Counting","Penalty Amount Adjusted For Eliminating Multiple Counting","Penalty Year","Penalty Date","Offense Group","Primary Offense","Secondary Offense","Description","Level of Government","Action Type","Agency","Civil/Criminal","Prosecution Agreement","Court","Case ID","Private Litigation Case Title","Lawsuit Resolution","Original System ID","Facility Name","Facility Address","Facility City","Facility State","Facility Zip","Facility County","NAICS Code","NAICS Translation","Current Parent HQ Country","Current Parent HQ State","Current Parent Ownership Structure","Current Parent Stock Ticker","Current Parent ISIN","Current Parent Major Industry","Current Parent Specific Industry","Info Source","PACER Link","Notes"
"3Red Trading LLC","","","","$2,500,000","$0","$2,500,000","2016","20161220","competition-related offenses","fraud","","","federal","agency action","Commodity Futures Trading Commission","civil","","","","","","","","","","","","","","","","","","","","","","http://www.cftc.gov/PressRoom/PressReleases/pr7504-16","",""
"4NExchange","","","","$480,000","$0","$480,000","2008","20081120","financial offenses","investor protection violation","securities issuance or trading violation","","federal","agency action","Commodity Futures Trading Commission","civil","","","","","","","","","","","","","","","","","","","","","","http://www.cftc.gov/PressRoom/PressReleases/pr5572-08","",""
"4X Solutions Inc.","","","","$10,980,904","$0","$10,980,904","2016","20160208","financial offenses","investor protection violation","securities issuance or trading violation","","federal","agency action","Commodity Futures Trading Commission","civil","","","","","","","","","","","","","","","","","","","","","","http://www.cftc.gov/PressRoom/PressReleases/pr7321-16","",""
"Aaristo Commodities and Futures DMCC","","","","$100,000","$0","$100,000","2008","20080409","financial offenses","investor protection violation","securities issuance or trading violation","","federal","agency action","Commodity Futures Trading Commission","civil","","","","","","","","","","","","","","","","","","","","","","http://www.cftc.gov/PressRoom/PressReleases/pr5481-08","",""
"ABN AMRO Clearing Chicago LLC","ABN AMRO","ABN Amro","","$1,000,000","$0","$1,000,000","2013","20130619","financial offenses","investor protection violation","securities issuance or trading violation","The U.S. Commodity Futures Trading Commission issued an Order settling charges against ABN AMRO Clearing Chicago LLC for failing to segregate or secure sufficient customer funds; failing to meet the minimum net capital requirements, failure to maintain accurate books and records, and failure to supervise its employees.","federal","agency action","Commodity Futures Trading Commission","civil","","","","","","","","","","","","","","","Netherlands","","privately held","","","financial services","banking","http://www.cftc.gov/PressRoom/PressReleases/pr6614-13","",""
"Absa Bank, Ltd.","","","","$150,000","$0","$150,000","2014","20140925","financial offenses","investor protection violation","securities issuance or trading violation","","federal","agency action","Commodity Futures Trading Commission","civil","","","","","","","","","","","","","","","","","","","","","","http://www.cftc.gov/PressRoom/PressReleases/pr7013-14","",""
"Acceleration Capital, LLC","","","","$218,000","$0","$218,000","2007","20070116","financial offenses","investor protection violation","securities issuance or trading violation","","federal","agency action","Commodity Futures Trading Commission","civil","","","","","","","","","","","","","","","","","","","","","","http://www.cftc.gov/PressRoom/PressReleases/pr5277-07","",""
"ACI Capital Group, L.L.C.","","","","$850,000","$0","$850,000","2012","20120514","financial offenses","investor protection violation","securities issuance or trading violation","","federal","agency action","Commodity Futures Trading Commission","civil","","","","","","","","","","","","","","","","","","","","","","http://www.cftc.gov/PressRoom/PressReleases/pr6257-12","",""
"ACJ Capital, Inc.","","","","$3,700,000","$0","$3,700,000","2012","20120326","financial offenses","investor protection violation","securities issuance or trading violation","","federal","agency action","Commodity Futures Trading Commission","civil","","","","","","","","","","","","","","","","","","","","","","http://www.cftc.gov/PressRoom/PressReleases/pr6218-12","",""
"ACJ Capital Inc., and Solid View Capital LLC","","","","$1,500,000","$0","$1,500,000","2013","20130618","financial offenses","investor protection violation","securities issuance or trading violation","","federal","agency action","Commodity Futures Trading Commission","civil","","","","","","","","","","","","","","","","","","","","","","http://www.cftc.gov/PressRoom/PressReleases/pr6613-13","",""
"ADM Investor Services, Inc.","Archer Daniels Midland","Archer Daniels Midland","","$200,000","$0","$200,000","2009","20090326","financial offenses","investor protection violation","securities issuance or trading violation","The U.S. Commodity Futures Trading Commission simultaneously filed and settled charges against ADM Investor Services, Inc. for violating rules governing post-execution allocations, maintenance of books and records, and supervision of its employees. The CFTC order sanctioned the company with a $200,000 civil monetary penalty.","federal","agency action","Commodity Futures Trading Commission","civil","","","","","","","","","","","","","","","USA","Illinois","publicly traded","ADM","US0394831020","agribusiness","agribusiness","http://www.cftc.gov/PressRoom/PressReleases/pr5639-09","",""
"ADM Investor Services, Inc.","Archer Daniels Midland","Archer Daniels Midland","","$425,000","$0","$425,000","2013","20130930","financial offenses","investor protection violation","securities issuance or trading violation","","federal","agency action","Commodity Futures Trading Commission","civil","","","","","","","","","","","","","","","USA","Illinois","publicly traded","ADM","US0394831020","agribusiness","agribusiness","http://www.cftc.gov/PressRoom/PressReleases/pr6726-13","",""
"Advanced Trading Workshop, Inc.","","","","$940,000","$0","$940,000","2016","20160927","financial offenses","investor protection violation","","","federal","agency action","Commodity Futures Trading Commission","civil","","","","","","","","","","","","","","","","","","","","","","http://www.cftc.gov/PressRoom/PressReleases/pr7453-16","",""
"Advantage Futures LLC","","","","$1,500,000","$0","$1,500,000","2016","20160921","financial offenses","investor protection violation","financial institution supervision failures","","federal","agency action","Commodity Futures Trading Commission","civil","","","","","","","","","","","","","","","","","","","","","","http://www.cftc.gov/PressRoom/PressReleases/pr7449-16","",""
"A.G. Edwards & Sons, Inc.","Wells Fargo","A.G. Edwards & Sons Inc.","In 2007 A.G. Edward was bought by Wachovia Corporation, which was acquired by Wells Fargo in 2008","$45,000","$0","$45,000","2003","20030625","miscellaneous offenses","data submission deficiencies","","","federal","agency action","Commodity Futures Trading Commission","civil","","","","","","","","","","","","","","","USA","California","publicly traded","WFC","US9497461015","financial services","banking","http://www.cftc.gov/opa/enf03/opa4801-03.htm","",""
"Agrocorp International Pte Ltd.","","","","$150,000","$0","$150,000","2016","20160711","financial offenses","investor protection violation","securities issuance or trading violation","","federal","agency action","Commodity Futures Trading Commission","civil","","","","","","","","","","","","","","","","","","","","","","http://www.cftc.gov/PressRoom/PressReleases/pr7405-16","",""
"Alaron Trading Corporation","","","","$299,000","$0","$299,000","2008","20080421","financial offenses","investor protection violation","financial institution supervision failures","","federal","agency action","Commodity Futures Trading Commission","civil","","","","","","","","","","","","","","","","","","","","","","http://www.cftc.gov/PressRoom/PressReleases/pr5488-08","",""
"Alaron Trading Corporation","","","","$260,000","$0","$260,000","2010","20100930","financial offenses","investor protection violation","securities issuance or trading violation","","federal","agency action","Commodity Futures Trading Commission","civil","","","","","","","","","","","","","","","","","","","","","","http://www.cftc.gov/PressRoom/PressReleases/pr5910-10","",""
"Alfred C. Toepfer International, Inc.","Archer Daniels Midland","Archer Daniels Midland","","$400,000","$0","$400,000","2015","20150930","financial offenses","investor protection violation","securities issuance or trading violation","","federal","agency action","Commodity Futures Trading Commission","civil","","","","","","","","","","","","","","","USA","Illinois","publicly traded","ADM","US0394831020","agribusiness","agribusiness","http://www.cftc.gov/PressRoom/PressReleases/pr7258-15","",""
"Allegheny Gulf Investments, Inc","","","","$440,000","$0","$440,000","2005","20050113","financial offenses","investor protection violation","securities issuance or trading violation","","federal","agency action","Commodity Futures Trading Commission","civil","","","","","","","","","","","","","","","","","","","","","","http://www.cftc.gov/opa/enf05/opa5039-05.htm","",""
"Alliance Capital Metals LLC and AR Goldman Wealth Management, LLC","","","","$2,500,000","$0","$2,500,000","2012","20120626","financial offenses","investor protection violation","securities issuance or trading violation","","federal","agency action","Commodity Futures Trading Commission","civil","","","","","","","","","","","","","","","","","","","","","","http://www.cftc.gov/PressRoom/PressReleases/pr6288-12","",""
"Alliance Development Company","","","","$2,200,000","$0","$2,200,000","2008","20081211","financial offenses","investor protection violation","securities issuance or trading violation","","federal","agency action","Commodity Futures Trading Commission","civil","","","","","","","","","","","","","","","","","","","","","","http://www.cftc.gov/PressRoom/PressReleases/pr5582-08","",""
"Alpha Trade Group S.A.","","","","$5,779,000","$0","$5,779,000","2013","20130625","financial offenses","investor protection violation","securities issuance or trading violation","","federal","agency action","Commodity Futures Trading Commission","civil","","","","","","","","","","","","","","","","","","","","","","http://www.cftc.gov/PressRoom/PressReleases/pr6620-13","",""
"AlphaMetrix, LLC","","","","$5,600,000","$0","$5,600,000","2014","20141218","financial offenses","investor protection violation","securities issuance or trading violation","","federal","agency action","Commodity Futures Trading Commission","civil","","","","","","","","","","","","","","","","","","","","","","http://www.cftc.gov/PressRoom/PressReleases/pr7083-14","",""
"Altamont Global Partners LLC","","","","$15,800,000","$0","$15,800,000","2014","20140228","financial offenses","investor protection violation","securities issuance or trading violation","","federal","agency action","Commodity Futures Trading Commission","civil","","","","","","","","","","","","","","","","","","","","","","http://www.cftc.gov/PressRoom/PressReleases/pr6869-14","",""
"Amaranth Advisors, L.L.C. and Amaranth Advisors (Calgary) ULC","","","","$7,500,000","$0","$7,500,000","2009","20090812","competition-related offenses","price-fixing or anti-competitive practices","energy market manipulation","The U.S. Commodity Futures Trading Commission announced that it entered into a consent order settling charges brought against Amaranth Advisors, L.L.C., based in Greenwich, Connecticut, and its Amaranth Advisors (Calgary) ULC subsidiary, based in Calgary, Alberta for attempting to manipulate the price of natural gas futures contracts on the New York Mercantile Exchange (NYMEX) on February 24 and April 26, 2006.","federal","agency action","Commodity Futures Trading Commission","civil","","","","","","","","","","","","","","","","","","","","","","http://www.cftc.gov/PressRoom/PressReleases/pr5692-09","",""
"American Bullion Exchange","","","","$18,000,000","$0","$18,000,000","2014","20141024","financial offenses","investor protection violation","securities issuance or trading violation","","federal","agency action","Commodity Futures Trading Commission","civil","","","","","","","","","","","","","","","","","","","","","","http://www.cftc.gov/PressRoom/PressReleases/pr7044-14","",""
"American Derivatives Corp. (ADC), Brokerage Management Corp.,","","","","$6,750,000","$0","$6,750,000","2009","20091216","financial offenses","investor protection violation","securities issuance or trading violation","","federal","agency action","Commodity Futures Trading Commission","civil","","","","","","","","","","","","","","","","","","","","","","http://www.cftc.gov/PressRoom/PressReleases/pr5762-09","",""
"American Electric Power Company, Inc. and AEP Energy Services, Inc.","American Electric Power","American Electric Power","","$30,000,000","$0","$30,000,000","2005","20050126","miscellaneous offenses","data submission deficiencies","","American Electric Power and its subsidiary AEPES agreed to pay $30 million to resolve CFTC allegations that they repeatedly and deliberately reported false natural gas trading information, including price and volume information, to certain firms that compile natural gas price indexes. The complaint further alleged that AEP and AEPES knowingly delivered false information to price index compilers in an attempt to skew those indexes for their financial benefit.","federal","agency action","Commodity Futures Trading Commission","civil","","","","","","","","","","","","","","","USA","Ohio","publicly traded","AEP","US0255371017","utilities and power generation","utilities","http://www.cftc.gov/opa/enf05/opa5041-05.htm","",""
"American Energy Exchange and York Commodities","","","","$3,652,788","$0","$3,652,788","2007","20070521","financial offenses","investor protection violation","securities issuance or trading violation","","federal","agency action","Commodity Futures Trading Commission","civil","","","","","","","","","","","","","","","","","","","","","","http://www.cftc.gov/PressRoom/PressReleases/pr5337-07","",""
"American Portfolio Asset Management, Inc.","","","","$578,474","$0","$578,474","2015","20150929","financial offenses","investor protection violation","securities issuance or trading violation","","federal","agency action","Commodity Futures Trading Commission","civil","","","","","","","","","","","","","","","","","","","","","","http://www.cftc.gov/PressRoom/PressReleases/pr7252-15","",""
"AmeriFirst Management LLC","","","","$35,000,000","$0","$35,000,000","2014","20140807","financial offenses","investor protection violation","securities issuance or trading violation","","federal","agency action","Commodity Futures Trading Commission","civil","","","","","","","","","","","","","","","","","","","","","","http://www.cftc.gov/PressRoom/PressReleases/pr6973-14","",""
"Angus Jackson, Inc.","","","","$2,800,000","$0","$2,800,000","2013","20130201","financial offenses","investor protection violation","securities issuance or trading violation","","federal","agency action","Commodity Futures Trading Commission","civil","","","","","","","","","","","","","","","","","","","","","","http://www.cftc.gov/PressRoom/PressReleases/pr6506-13","",""
"Angus Partners LLC","","","","$250,000","$0","$250,000","2016","20160929","financial offenses","investor protection violation","","","federal","agency action","Commodity Futures Trading Commission","civil","","","","","","","","","","","","","","","","","","","","","","http://www.cftc.gov/PressRoom/PressReleases/pr7462-16","",""
"Aquila Merchant Services","Evergy Inc.","Aquila, Inc.","In 2008 Aquila was acquired by Great Plains Energy, which merged with Westar Energy to form Evergy in 2018 ","$26,500,000","$0","$26,500,000","2004","20040128","competition-related offenses","price-fixing or anti-competitive practices","energy market manipulation","","federal","agency action","Commodity Futures Trading Commission","civil","","","","","","","","","","","","","","","USA","Missouri","publicly traded","EVRG","US30034W1062","utilities and power generation","utilities","http://www.cftc.gov/opa/enf04/opa4883-04.htm","",""
"Arjent Capital Markets LLC and Chicago Trading Managers LLC","","","","$1,800,000","$0","$1,800,000","2013","20130516","financial offenses","investor protection violation","securities issuance or trading violation","","federal","agency action","Commodity Futures Trading Commission","civil","","","","","","","","","","","","","","","","","","","","","","http://www.cftc.gov/PressRoom/PressReleases/pr6589-13","",""
"Armajaro Trading Limited","","","","$35,000","$0","$35,000","2005","20050629","financial offenses","investor protection violation","securities issuance or trading violation","","federal","agency action","Commodity Futures Trading Commission","civil","","","","","","","","","","","","","","","","","","","","","","http://www.cftc.gov/opa/enf05/opa5093-05.htm","",""
"Assurance Capital Management, LLC","","","","$1,969,165","$0","$1,969,165","2017","20170711","financial offenses","investor protection violation","securities issuance or trading violation","The U.S. Commodity Futures Trading Commission (CFTC) announced that Judge Susan C. Bucklew of the U.S. District Court for the Middle District of Florida entered an Order of Final Judgment by Default against Defendants Anthony J. Klatch II, Lindsey Heim, and their company Assurance Capital Management, LLC for defrauding pool participants in a commodity pool they operated, misappropriating pool participants' funds, and other violations of the Commodity Exchange Act and CFTC Regulations.","federal","agency action","Commodity Futures Trading Commission","civil","","","","","","","","","","","","","","","","","","","","","","http://www.cftc.gov/PressRoom/PressReleases/pr7589-17","",""
"Atlantas Group, Inc.","","","","$7,200,000","$0","$7,200,000","2016","20160714","financial offenses","investor protection violation","securities issuance or trading violation","The U.S. Commodity Futures Trading Commission issued an Order filing and simultaneously settling charges against Atlantas Group, Inc. and Edmund Hysni for committing solicitation fraud in connection with options on futures contracts trading on the Chicago Board of Trade and the Commodity Exchange, Inc., and against Hysni for willfully making material false statements to the National Futures Association (NFA) in connection with its investigation of the fraud.","federal","agency action","Commodity Futures Trading Commission","civil","","","","","","","","","","","","","","","","","","","","","","http://www.cftc.gov/PressRoom/PressReleases/pr7407-16","",""
"Aurifex Commodities Research Company","","","","$150,000","$0","$150,000","2008","20081125","financial offenses","investor protection violation","securities issuance or trading violation","","federal","agency action","Commodity Futures Trading Commission","civil","","","","","","","","","","","","","","","","","","","","","","http://www.cftc.gov/PressRoom/PressReleases/pr5573-08","",""
"Australia and New Zealand Banking Group Ltd.","Australia and New Zealand Banking Group","Australia and New Zealand Banking Group","","$350,000","$0","$350,000","2012","20120927","financial offenses","investor protection violation","securities issuance or trading violation","","federal","agency action","Commodity Futures Trading Commission","civil","","","","","","","","","","","","","","","Australia","","publicly traded","","AU000000ANZ3","financial services","banking","http://www.cftc.gov/PressRoom/PressReleases/pr6367-12","",""
"Australia and New Zealand Banking Group Ltd.","Australia and New Zealand Banking Group","Australia and New Zealand Banking Group","","$150,000","$0","$150,000","2015","20150917","financial offenses","investor protection violation","securities issuance or trading violation","","federal","agency action","Commodity Futures Trading Commission","civil","","","","","","","","","","","","","","","Australia","","publicly traded","","AU000000ANZ3","financial services","banking","http://www.cftc.gov/PressRoom/PressReleases/pr7233-15","",""
"Avista Energy","Avista","Avista","","$2,100,000","$0","$2,100,000","2001","20010821","competition-related offenses","price-fixing or anti-competitive practices","energy market manipulation","","federal","agency action","Commodity Futures Trading Commission","civil","","","","","","","","","","","","","","","USA","Washington","publicly traded","AVA","US05379B1070","utilities and power generation","utilities","http://www.cftc.gov/opa/enf01/opa4555-01.htm","",""
"Axcess Automation LLC and Axcess Fund Management LLC","","","","$41,000,000","$0","$41,000,000","2012","20120716","financial offenses","investor protection violation","securities issuance or trading violation","","federal","agency action","Commodity Futures Trading Commission","civil","","","","","","","","","","","","","","","","","","","","","","http://www.cftc.gov/PressRoom/PressReleases/pr6304-12","",""
"Axess Trading Co., Inc.","","","","$569,437","$0","$569,437","2006","20060921","financial offenses","investor protection violation","securities issuance or trading violation","","federal","agency action","Commodity Futures Trading Commission","civil","","","","","","","","","","","","","","","","","","","","","","http://www.cftc.gov/PressRoom/PressReleases/pr5230-06","",""
"Badge Trading LLC","","","","$280,000","$0","$280,000","2016","20160405","financial offenses","investor protection violation","securities issuance or trading violation","","federal","agency action","Commodity Futures Trading Commission","civil","","","","","","","","","","","","","","","","","","","","","","http://www.cftc.gov/PressRoom/PressReleases/pr7355-16","",""
"Banc de Binary Ltd.","","","","$9,100,000","$0","$9,100,000","2016","20160309","financial offenses","investor protection violation","securities issuance or trading violation","","federal","agency action","Commodity Futures Trading Commission","civil","","","","","","","","","","","","","","","","","","","","","","http://www.cftc.gov/PressRoom/PressReleases/pr7336-16","",""
"Banque CIAL","","","","$80,000","$0","$80,000","2007","20070928","financial offenses","investor protection violation","securities issuance or trading violation","","federal","agency action","Commodity Futures Trading Commission","civil","","","","","","","","","","","","","","","","","","","","","","http://www.cftc.gov/PressRoom/PressReleases/pr5393-07","",""
"Barclays","Barclays","Barclays","","$400,000,000","$0","$400,000,000","2015","20150520","competition-related offenses","price-fixing or anti-competitive practices","interest rate benchmark manipulation","The U.S. Commodity Futures Trading Commission issued an Order filing and settling charges against Barclays Bank PLC for attempted manipulation, false reporting, and aiding and abetting other banks' attempts to manipulate, global foreign exchange (FX) benchmark rates to benefit the positions of certain traders.","federal","agency action","Commodity Futures Trading Commission","civil","","","","","","","","","","","","","","","United Kingdom","","publicly traded","LSE: BARC","GB0031348658","financial services","banking","http://www.cftc.gov/PressRoom/PressReleases/pr7181-15","",""
"Barclays","Barclays","Barclays","","$115,000,000","$0","$115,000,000","2015","20150520","competition-related offenses","price-fixing or anti-competitive practices","interest rate benchmark manipulation","The U.S. Commodity Futures Trading Commission issued an Order filing and settling allegations that Barclays PLC, Barclays Bank PLC, and Barclays Capital Inc. attempted on many occasions to manipulate and made false reports concerning the U.S. Dollar International Swaps and Derivatives Association Fix (USD ISDAFIX), a global benchmark for interest rate products.","federal","agency action","Commodity Futures Trading Commission","civil","","","","","","","","","","","","","","","United Kingdom","","publicly traded","LSE: BARC","GB0031348658","financial services","banking","http://www.cftc.gov/PressRoom/PressReleases/pr7180-15","",""
"Barclays Capital Inc.","Barclays","Barclays","","$800,000","$0","$800,000","2016","20160804","financial offenses","investor protection violation","financial institution supervision failures","The U.S. Commodity Futures Trading Commission issued an Order filing and simultaneously settling charges against Barclays Capital, Inc. for failing to diligently supervise its officers', employees' and agents' processing of exchange and clearing fees it charged customers for trading and clearing Chicago Mercantile Exchange products from January 2011 to April 2015.","federal","agency action","Commodity Futures Trading Commission","civil","","","","","","","","","","","","","","","United Kingdom","","publicly traded","LSE: BARC","GB0031348658","financial services","banking","http://www.cftc.gov/PressRoom/PressReleases/pr7419-16","",""
